{"$schema":"https://json-schema.org/draft/2020-12/schema","type":"object","additionalProperties":false,"required":["schemaVersion","contentVersion","id","sourceId","title","description","language","sourceFile","lessonsFile"],"properties":{"schemaVersion":{"const":"1.0.0"},"contentVersion":{"type":"integer","minimum":1},"id":{"type":"string","pattern":"^youtube-[A-Za-z0-9_-]{11}$"},"sourceId":{"type":"string","pattern":"^youtube:[A-Za-z0-9_-]{11}$"},"title":{"type":"string","minLength":1},"description":{"type":"string","minLength":1},"language":{"type":"string","minLength":2},"sourceFile":{"const":"./source.json"},"lessonsFile":{"const":"./lessons.json"}}}
